ID	ISBN	Price	Title	Teaser	Auth_1	Auth_2	Auth_3	Review	Reviewer	Issue_date	Issue	Record_type	Sub_headline	Headline	Publisher	Pub_date	Categories	SubCategories	Metadata	Image	Field21
4407	9781572336780	$42.00 hardcover	Reminiscences of an Old Georgia Lawyer		Rushing, S. Kittrell (ed.)			"<a href=""http://utpress.org/a/searchdetails.php?jobno=T01278"" target=""resource window"">Click here for more information</a>"		Winter 2010	2010-02-01	Annotation			University of Tennessee Press					"<img hspace=6 align=LEFT width=161 height=242 alt=""Product Cover"" border=0 src=""/civilwarbookreview/images/jackets/Lawyer.jpg"">"	
4069	9781572336162	$38.95 hardcover	Gentlemen Merchants		Racine, Philip N.			"<a href=""http://utpress.org/a/searchdetails.php?jobno=T01283"" target=""resource window"">Click here for more information</a>"		Fall 2008	2008-11-01	Annotation			The University of Tennessee Press					"<img hspace=6 align=LEFT width=161 height=237 alt=""Product Cover"" border=0 src=""/civilwarbookreview/images/jackets/GentlemenMerchants.jpg"">"	
4297	9781572336223	$38.95 hardcover	The Golden Age of Battlefield Preservation: The Decade of the 1980s and the Establishment of America’s First Five Military Parks		Smith, Timothy B.			"<a href=""http://utpress.org/a/searchdetails.php?jobno=T01285"" target=""resource window"">Click here for more information</a>"		Summer 2009	2009-08-01	Annotation			The University of Tennessee Press					"<img hspace=6 align=LEFT width=161 height=248 alt=""Product Cover"" border=0 src=""/civilwarbookreview/images/jackets/GoldenAge.jpg"">"	
4084	9781572336179	$33.00 hardcover	The Battle of Shiloh		Reed, David W.			"<a href=""http://utpress.org/a/searchdetails.php?jobno=t01286"" target=""resource window"">Click here for more information</a>"		Fall 2008	2008-11-01	Annotation			University of Tennessee Press					"<img hspace=6 align=LEFT width=161 height=242 alt=""Product Cover"" border=0 src=""/civilwarbookreview/images/jackets/TheBattleOfShiloh.jpg"">"	
4200	9781572336308	$ 34.95 hardcover	Lee’s Last Casualty: The Life and Letters of Sgt. Robert W. Parker, Second Virginia Cavalry		Wright, Catherine M., ed.			"<a href=""http://utpress.org/a/searchdetails.php?jobno=T01288"" target=""resource window"">Click here for more information</a>"		Spring 2009	2009-05-01	Annotation			The University of Tennessee Press					"<img hspace=6 align=LEFT width=161 height=239 alt=""Product Cover"" border=0 src=""/civilwarbookreview/images/jackets/LastCasualty.jpg"">"	
4204	9781572336339	$45.00 hardcover	Nashville: The Occupied City, 1862-1863		Durham, Walter T.			"<a href=""http://utpress.org/a/searchdetails.php?jobno=T01298"" target=""resource window"">Click here for more information</a>"		Spring 2009	2009-05-01	Annotation			The University of Tennessee Press					"<img hspace=6 align=LEFT width=161 height=244 alt=""Product Cover"" border=0 src=""/civilwarbookreview/images/jackets/Nashville.jpg"">"	
4209	9781572336346	$45.00 hardcover	Reluctant Partners: Nashville and the Union, 1863-1865		Durham, Walter T.			"<a href=""http://utpress.org/a/searchdetails.php?jobno=T01299"" target=""resource window"">Click here for more information</a>"		Spring 2009	2009-05-01	Annotation			The University of Tennessee Press					"<img hspace=6 align=LEFT width=161 height=245 alt=""Product Cover"" border=0 src=""/civilwarbookreview/images/jackets/ReluctantPartners.jpg"">"	
4227	9781572336353	$45.00 hardcover	Yale’s Confederates: A Biographical Dictionary		Hughes, Nathaniel Cheairs, Jr.			"<a href=""http://utpress.org/a/searchdetails.php?jobno=T01301"" target=""resource window"">Click here for more information</a>"		Spring 2009	2009-05-01	Annotation			The University of Tennessee Press					"<img hspace=6 align=LEFT width=161 height=213 alt=""Product Cover"" border=0 src=""/civilwarbookreview/images/jackets/YalesConfederates.jpg"">"	
4271	9781572336544	$36.00 hardcover	John Mitchel: Irish Nationalist, Southern Secessionist		McGovern, Bryan P.			"<a href=""http://utpress.org/a/searchdetails.php?jobno=T01303"" target=""resource window"">Click here for more information</a>"		Summer 2009	2009-08-01	Annotation			The University of Tennessee Press					"<img hspace=6 align=LEFT width=161 height=249 alt=""Product Cover"" border=0 src=""/civilwarbookreview/images/jackets/JohnMitchel.jpg"">"	
4372	9781572336636	$35.95 hardcover	Great Things are Expected of Us: The Letters of Colonel C. Irvine Walker, 10th South Carolina Infantry, C.S.A.		White, William Lee (ed.)	Runion, Charles Denny (ed.)		"<a href=""http://utpress.org/a/searchdetails.php?jobno=T01324"" target=""resource window"">Click here for more information</a>"		Fall 2009	2009-11-01	Annotation			University of Tennessee Press					"<img hspace=6 align=LEFT width=161 height=239 alt=""Product Cover"" border=0 src=""/civilwarbookreview/images/jackets/GreatThingsAreExpected.jpg"">"	
4506	9781572336278	$33.95 softcover	Fort Donelson’s Legacy: War and Society in Kentucky and Tennessee, 1862-1863 (new in paper)		Cooling, Benjamin Franklin			"<a href=""http://utpress.org/bookdetail-2/?jobno=T00570.01.01&authorsm=Cooling,%20Benjamin%20Franklin"" target=""resource window"">Click here for more information</a>"		Fall 2010	2010-11-01	Annotation			University of Tennessee Press					"<img hspace=6 align=LEFT width=161 height=241 alt=""Product Cover"" border=0 src=""/civilwarbookreview/images/jackets/FortDonelsonsLegacy.jpg"">"	
4740	9781572337312	$24.95 hardcover	Thinking Confederates: Academia and the Idea of Progress in the New South (now in paper)		Frost, Dan R.			"<a href=""http://utpress.org/bookdetail-2/?jobno=T00699.01.01&authorsm=Frost,%20Dan%20R."" target=""resource window"">Click here for more information</a>"		Winter 2011	2011-02-01	Annotation			The University of Tennessee Press					"<img hspace=6 align=LEFT width=161 height=243 alt=""Product Cover"" border=0 src=""/civilwarbookreview/images/jackets/ThinkingConfederates.jpg"">"	
5528	9781572338692	$49.95	A Documentary History of the American Civil War Ear: Volume 1 Legislative Achievements		Mackey, Thomas			"<a href=""http://utpress.org/bookdetail-2/?jobno=T01201"">Click here for more information</a>"		Fall 2013	2013-11-01	Annotation			The University of Tennessee Press					"<img hspace=6 align=LEFT width=161 height=236 alt=""Product Cover"" border=0 src=""/civilwarbookreview/images/jackets/ADocumentaryHistoryVolume1.jpg"">"	
4787	9781572337473	$46.00 hardcover	Refugitta of Richmond: The Wartime Recollections, Grave and Gay, of Constance Cary Harrison		Hughes, Nathaniel Cheairs Jr. (ed.)	Rushing, S. Kittrell (ed.)		"<a href=""http://utpress.org/bookdetail-2/?jobno=T01448&authorsm=Hughes,%20Nathaniel%20Cheairs%20%20Jr."" target=""resource window"">Click here for more information</a>"		Spring 2011	2011-05-01	Annotation			The University of Tennessee Press					"<img hspace=6 align=LEFT width=161 height=244 alt=""Product Cover"" border=0 src=""/civilwarbookreview/images/jackets/RefugittaOfRichmond.jpg"">"	
5155	978-1-57233-760-2	$40.00	Record of the Organizations Engaged in the Campaign, Siege, and Defense of Vicksburg		Kountz, John S.			"<a href=""http://utpress.org/bookdetail-2/?jobno=T01450"" target=""resource window"">Click here for more information</a>"		Summer 2012	2012-08-01	Annotation			University of Tennessee Press					"<img hspace=6 align=LEFT width=161 height=242 alt=""Product Cover"" border=0 src=""/civilwarbookreview/images/jackets/RecordOfTheOrganizations.jpg"">"	
4729	9781572337275	$29.95 softcover	Summer Thunder: A Battlefield Guide to the Artillery at Gettysburg		Spruill, Matt			"<a href=""http://utpress.org/bookdetail-2/?jobno=T01451"" target=""resource window"">Click here for more information</a>"		Winter 2011	2011-02-01	Annotation			University of Tennessee Press					"<img hspace=6 align=LEFT width=161 height=245 alt=""Product Cover"" border=0 src=""/civilwarbookreview/images/jackets/SummerThunder.jpg"">"	
4853	9781572337299	$52.00 hardcover	Last to Leave the Field:  The Life and Letters of First Sergeant Ambrose Henry Hayward, 28th Pennsylvania Volunteer Infantry		Orr, Timothy J. (ed.)			"<a href=""http://utpress.org/bookdetail-2/?jobno=T01473"" target=""resource window"">Click here for more information</a>"		Summer 2011	2011-08-01	Annotation			The University of Tennessee Press					"<img hspace=6 align=LEFT width=161 height=244 alt=""Product Cover"" border=0 src=""/civilwarbookreview/images/jackets/LastToLeaveTheField.jpg"">"	
4844	9781572337459	$24.95 softcover	Decisions at Gettysburg: The Nineteen Critical Decisions that Defined the Campaign		Spruill, Matt			"<a href=""http://utpress.org/bookdetail-2/?jobno=T01499&authorsm=Spruill,%20Matt"" target=""resource window"">Click here for more information</a>"		Summer 2011	2011-08-01	Annotation			The University of Tennessee Press					"<img hspace=6 align=LEFT width=161 height=242 alt=""Product Cover"" border=0 src=""/civilwarbookreview/images/jackets/DecisionsAtGettysburg.jpg"">"	
5460	978-1-57233-873-9	$44.95	The Letters of General Richard S. Ewell: Stonewall's Successor		Pfanz, Donald C. (ed)	Carmichael, Peter S. (series ed.)		"<a href=""http://utpress.org/bookdetail-2/?jobno=T01523&authorsm=Pfanz,%20Donald%20C."">Click here for more information</a>"		Summer 2013	2013-08-01	Annotation			University of Tennessee Press					"<img hspace=6 align=LEFT width=161 height=239 alt=""Product Cover"" border=0 src=""/civilwarbookreview/images/jackets/TheLettersOfGeneralRichardSEwell.jpg"">"	
5489	9781572338548	$39.00	David Schenck and the Contours of Confederate Identity		Steward, Rodney			"<a href=""http://utpress.org/bookdetail-2/?jobno=T01527&authorsm=Steward,%20Rodney"">Click here for more information</a>"		Summer 2013	2013-08-01	Annotation			University of Tennessee Press					"<img hspace=6 align=LEFT width=161 height=242 alt=""Product Cover"" border=0 src=""/civilwarbookreview/images/jackets/DavidSchenck.jpg"">"	
5372	9781572338487	$39.95	A Yankee Horseman in the Shenandoah Valley: The Civil War Letters of John H. Black, Twelfth Pennsylvania Cavalry		Coles, David J. (ed.)	Engle, Stephen D. (ed.)		"<a href=""http://utpress.org/bookdetail-2/?jobno=T01552"">Click here for more information</a>"		Spring 2013	2013-05-01	Annotation			University of Tennessee Press					"<img hspace=6 align=LEFT width=161 height=242 alt=""Product Cover"" border=0 src=""/civilwarbookreview/images/jackets/AYankeeHorsemanInTheShenandoahValley.jpg"">"	
5812	9781621900139	$74.00	Southern Women Novelists And The  Civil War: Trauma and Collective Memory in the American Literary Tradition since 1861		Talley, Sharon			"<a href=""http://utpress.org/bookdetail-2/?jobno=T01560"">Click here for more information</a>"		Fall 2014	2014-11-01	Annotation			The University of Tennessee Press					"<img hspace=6 align=LEFT width=161 height=243 alt=""Product Cover"" border=0 src=""/civilwarbookreview/images/jackets/SouthernWomenCollectiveMemory.jpg"">"	
5618	9781621900023	$95.00	North Carolina English, 1861-1865: A Guide and Glossary		Ellis, Michael			"<a href=""http://utpress.org/bookdetail-2/?jobno=T01618"">Click here for more information</a>"		Winter 2014	2014-02-01	Annotation			The University of Tennessee Press					"<img hspace=6 align=LEFT width=161 height=196 alt=""Product Cover"" border=0 src=""/civilwarbookreview/images/jackets/NorthCarolinaEnglish.jpg"">"	
5529	9781572339484	$49.95	A Documentary History of the American Civil War Era: Volume 2 Political Arguments		Mackey, Thomas			"<a href=""http://utpress.org/bookdetail-2/?jobno=T01660"">Click here for more information</a>"		Fall 2013	2013-11-01	Annotation			The University of Tennessee Press					"<img hspace=6 align=LEFT width=161 height=237 alt=""Product Cover"" border=0 src=""/civilwarbookreview/images/jackets/ADocumentaryHistoryVolume2.jpg"">"	
5871	9781621900405	$49.95	A Documentary History of the American Civil War Era: Volume 4 Judicial Decisions 1867-1896		Mackey, Thomas C.			"<a href=""http://utpress.org/bookdetail-2/?jobno=T01660"">Click here for more information</a>"		Winter 2015	2015-02-01	Annotation			The University Of Tennessee Press					"<img hspace=6 align=LEFT width=161 height=243 alt=""Product Cover"" border=0 src=""/civilwarbookreview/images/jackets/ADocumentaryOfWarVolume.jpg"">"	
5616	9781572339989	$32.95	Summer Lightning: A Guide to the Second Battle of Manassas		Spruill III, Matt	Spruill IV, Matt		"<a href=""http://utpress.org/bookdetail-2/?jobno=T01692"">Click here for more information</a>"		Winter 2014	2014-02-01	Annotation			The University of Tennessee Press					"<img hspace=6 align=LEFT width=161 height=242 alt=""Product Cover"" border=0 src=""/civilwarbookreview/images/jackets/SummerLightning.jpg"">"	
5759	9781621900382	$34.95	The Diary of Nannie Haskins Williams: A Southern Woman's Story of Rebellion and Reconstruction, 1863-1890		Uffelman, Ellen Kanervo	Smith, Phyllis		"<a href=""http://utpress.org/bookdetail-2/?jobno=T01695"">Click here for more information</a>"		Summer 2014	2014-08-01	Annotation			University of Tennessee Press					"<img hspace=6 align=LEFT width=161 height=243 alt=""Product Cover"" border=0 src=""/civilwarbookreview/images/jackets/NannieHaskinsWilliams.jpg"">"	
5713	9781621900054	$65.00	A Documentary History of the American Civil War Era: Volume 3, Judicial Decisions 1857-1866		Mackey, Thomas			"<a href=""http://utpress.org/bookdetail-2/?jobno=T01754"">Click here for more information</a>"		Spring 2014	2014-05-01	Annotation			The University of Tennessee Press					"<img hspace=6 align=LEFT width=161 height=237 alt=""Product Cover"" border=0 src=""/civilwarbookreview/images/jackets/ADocumentaryHistory.jpg"">"	
5839	9781621900504	$29.95	Freedom's Delay: America's Struggle for Emancipation 1776-1865		Carden, Allen			"<a href=""http://utpress.org/bookdetail-2/?jobno=T01768&authorsm=Carden,%20Allen"">Click here for more information</a>"		Fall 2014	2014-11-01	Annotation			University of Tennessee Press					"<img hspace=6 align=LEFT width=161 height=242 alt=""Product Cover"" border=0 src=""/civilwarbookreview/images/jackets/FreedomsDelayStruggle.jpg"">"	
4447	9781572336582	$44.95 hardcover	In the Shadow of the Enemy: The Civil War Journal of Ida Powell Dulany		Mackall, Mary L. (ed.); Meserve, Stevan F. (ed.); Sasscer, Anne Mackall (ed.)			"<a href=""http://utpress.org/bookdetail/?jobno=T01319"" target=""resource window"">Click here for more information</a>"		Winter 2010	2010-02-01	Annotation			University of Tennessee Press					"<img hspace=6 align=LEFT width=161 height=242 alt=""Product Cover"" border=0 src=""/civilwarbookreview/images/jackets/ShadowOfTheEnemy.jpg"">"	
4603	9781572336940	$34.95 hardcover	The Battles of Chickamauga and Chattanooga and the Organizations Engaged		Boynton, Henry V.			"<a href=""http://utpress.org/bookdetail/?jobno=T01322"" target=""resource window"">Click here for more information</a>"		Summer 2010	2010-08-01	Annotation			University of Tennessee Press					"<img hspace=6 align=LEFT width=161 height=245 alt=""Product Cover"" border=0 src=""/civilwarbookreview/images/jackets/BattlesOfChickamaugaAndChattanooga.jpg"">"	
4488	9781572336827	$59.00 hardcover	Crimson Confederates: Harvard Men Who Fought for the South		Trimpi, Helen P.			"<a href=""http://utpress.org/bookdetail/?jobno=T01360"" target=""resource window"">Click here for more information</a>"		Spring 2010	2010-05-01	Annotation			University of Tennessee Press					"<img hspace=6 align=LEFT width=161 height=211 alt=""Product Cover"" border=0 src=""/civilwarbookreview/images/jackets/Crimson.jpg"">"	
4445	9781572336698	$35.00 hardcover	Lincoln Under Enemy Fire: The Complete Account of His Experiences during Early’s Attack on Washington		Cramer, John Henry			"<a href=""http://utpress.org/bookdetail/?jobno=T01370"" target=""resource window"">Click here for more information</a>"		Winter 2010	2001-02-01	Annotation			The University of Tennessee Press					"<img hspace=6 align=LEFT width=161 height=238 alt=""Product Cover"" border=0 src=""/civilwarbookreview/images/jackets/LincolnUnderFire.jpg"">"	
4578	9781572337008	$45.95 hardcover	Confederate Generals in the Western Theater Volume 1: Classic Essays on America’s Civil War		Hewitt, Lawrence Lee (ed.)	Bergeron, Arthur W. Jr. (ed.)		"<a href=""http://utpress.org/bookdetail/?jobno=T01371&authorsm=Hewitt,%20Lawrence%20Lee"" target=""resource window"">Click here for more information</a>"		Summer 2010	2010-08-01	Annotation			University of Tennessee Press					"<img hspace=6 align=LEFT width=161 height=245 alt=""Product Cover"" border=0 src=""/civilwarbookreview/images/jackets/ConfederateGeneralsVol1.jpg"">"	
4579	9781572336995	$45.95 hardcover	Confederate Generals in the Western Theater Volume 2: Essays on America’s Civil War		Hewitt, Lawrence Lee (ed.)	Bergeron, Arthur W. Jr. (ed.)		"<a href=""http://utpress.org/bookdetail/?jobno=T01372&authorsm=Hewitt,%20Lawrence%20L."" target=""resource window"">Click here for more information</a>"		Summer 2010	2010-08-01	Annotation			University of Tennessee Press					"<img hspace=6 align=LEFT width=161 height=245 alt=""Product Cover"" border=0 src=""/civilwarbookreview/images/jackets/ConfederateGeneralsVol2.jpg"">"	
4540	9781572337039	$54.95 hardcover	Notes of the Mexican War, 1846-1848		Oswandel, J. Jacob	Johnson, Timothy D. (ed.); Hughes, Nathaniel Cheairs Jr. (ed.)		"<a href=""http://utpress.org/bookdetail/?jobno=T01408"" target=""resource window"">Click here for more information</a>"		Spring 2010	2010-05-01	Annotation			University of Tennessee Press					"<img hspace=6 align=LEFT width=161 height=244 alt=""Product Cover"" border=0 src=""/civilwarbookreview/images/jackets/Notes.jpg"">"	
5557	9781572338661	$54.95	Confederate Generals in the Trans-Mississippi: Essays on America's Civil War-Volume I		Hewitt, Lawrence L.	Bergeron, Arthur Jr.; Schott, Thomas		"<a href=""http://utpress.org/title/confederate-generals-in-the-trans-mississippi-vol-1/"">Click here for more information</a>"		Fall 2013	2013-11-01	Annotation			The University of Tennessee Press					"<img hspace=6 align=LEFT width=161 height=243 alt=""Product Cover"" border=0 src=""/civilwarbookreview/images/jackets/ConfederateGeneralsInTheTrans-Mississippi.jpg"">"	
6065	9781621900894	$64.95	Confederate Generals in the Trans-Mississippi: Essays on America's Civil War-Volume II		Hewitt, Lawrence Lee	Schott, Thomas E.		"<a href=""http://utpress.org/title/confederate-generals-in-the-trans-mississippi-vol-2/"">Click here for more information</a>"		Fall 2015	2015-11-01	Annotation			University of Tennessee Press					"<img hspace=6 align=LEFT width=161 height=238 alt=""Product Cover"" border=0 src=""/civilwarbookreview/images/jackets/HewittConfGensTransMS2.jpg"">"	
6060	9781621901631	$59.95	Memoirs of Lieut.-General Winfield Scott		Johnson, Timothy D.			"<a href=""http://utpress.org/title/memoirs-of-lieut-general-winfield-scott/"">Click here for more information</a>"		Fall 2015	2015-11-01	Annotation			University of Tennessee Press					"<img hspace=6 align=LEFT width=161 height=243 alt=""Product Cover"" border=0 src=""/civilwarbookreview/images/jackets/GrayScottMemoirs.jpg"">"	
6125	9781621901259	$48.50	Service with the Signal Corps: The Civil War Memoir of Captain Louis R. Fortescue		Acken, J. Gregory			"<a href=""http://utpress.org/title/service-with-the-signal-corps/"">Click here for more information</a>"		Winter 2016	2016-02-01	Annotation			University of Tennessee Press					"<img hspace=6 align=LEFT width=161 height=242 alt=""Product Cover"" border=0 src=""/civilwarbookreview/images/jackets/AckenServicewiththeSignalCorps.jpg"">"	
6126	9781621901228	$49.95	To Succeed or Perish: The Diaries of Sergeant Edmund Trent Eggleston, 1st Mississippi Light Artillery Regiment, CSA		Hewitt, Lawrence Lee	Schott, Thomas E.; and Kunis, Marc		"<a href=""http://utpress.org/title/to-succeed-or-perish/"">Click here for more information</a>"		Winter 2016	2016-02-01	Annotation			University of Tennessee Press					"<img hspace=6 align=LEFT width=161 height=243 alt=""Product Cover"" border=0 src=""/civilwarbookreview/images/jackets/HewittToSucceedorPerish.jpg"">"	
6063	9781621901624	$24.95	Winter Lightning: A Guide to the Battle of Stones River (second edition)		Spruill, Matt	Spruill, Lee		"<a href=""http://utpress.org/title/winter-lightning/"">Click here for more information</a>"		Fall 2015	2015-11-01	Annotation			University of Tennessee Press					"<img hspace=6 align=LEFT width=161 height=241 alt=""Product Cover"" border=0 src=""/civilwarbookreview/images/jackets/SpruillWinterLightningSecond.jpg"">"	
5302	978-0-299-29120-4	$26.95	"Letters Home to Sarah: The Civil War Letters of Guy C. Taylor,
Thirty-Sixth Wisconsin Volunteers"		Alderson, Kevin (ed.)	Alderson, Patsy (ed.)		"<a href=""http://uwpress.wisc.edu/books/5002.htm"">Click here for more information</a>"		Winter 2013	2013-02-01	Annotation			University of Wisconsin Press					"<img hspace=6 align=LEFT width=161 height=244 alt=""Product Cover"" border=0 src=""/civilwarbookreview/images/jackets/LettersHomeToSarah.jpg"">"	
5774	9780299294809	$26.95	A Quiet Corner of the War: The Civil War Letters of Gilbert and Esther Claflin, Oconomowoc, Wisconsin, 1862-1863		Cook, Judy			"<a href=""http://uwpress.wisc.edu/books/5217.htm"">Click here for more information</a>"		Summer 2014	2014-08-01	Annotation			University of Wisconsin Press					"<img hspace=6 align=LEFT width=161 height=242 alt=""Product Cover"" border=0 src=""/civilwarbookreview/images/jackets/AQuietCorner.jpg"">"	
4724	9781574413007	$19.95 softcover	Queen of the Confederacy: The Innocent Deceits of Lucy Holcombe Pickens		Lewis, Elizabeth Wittenmyer			"<a href=""http://web3.unt.edu/untpress/catalog/detail.cfm?ID=217"" target=""resource window"">Click here for more information</a>"		Winter 2011	2011-02-01	Annotation			UNT Press					"<img hspace=6 align=LEFT width=161 height=245 alt=""Product Cover"" border=0 src=""/civilwarbookreview/images/jackets/QueenOfTheConfederacy.jpg"">"	
4727	97815744130147	$19.95 softcover	Spartan Band: Burnett’s 13th Texas Cavalry in the Civil War		Reid, Thomas			"<a href=""http://web3.unt.edu/untpress/catalog/detail.cfm?ID=239"" target=""resource window"">Click here for more information</a>"		Winter 2011	2011-02-01	Annotation			UNT Press					"<img hspace=6 align=LEFT width=161 height=242 alt=""Product Cover"" border=0 src=""/civilwarbookreview/images/jackets/SpartanBand.jpg"">"	
4832	9781574413113		Andersonvilles of the North: The Myths and Realities of Northern Treatment of Civil War Confederate Prisoners		Gillispie, James M.			"<a href=""http://web3.unt.edu/untpress/catalog/detail.cfm?ID=303"" target=""resource window"">Click here for more information</a>"		Summer 2011	2011-08-01	Annotation			University of North Texas Press					"<img hspace=6 align=LEFT width=161 height=243 alt=""Product Cover"" border=0 src=""/civilwarbookreview/images/jackets/AndersonvillesOfTheNorth.jpg"">"	
4212	9781574412512	$60.00 hardcover	Texas Civil War Artifacts: A Photographic Guide to the Physical Culture of Texas Civil War Soldiers		Ahlstrom, Richard Mather			"<a href=""http://web3.unt.edu/untpress/catalog/detail.cfm?ID=306"" target=""resource window"">Click here for more information</a>"		Spring 2009	2009-05-01	Annotation			University of North Texas Press					"<img hspace=6 align=LEFT width=161 height=204 alt=""Product Cover"" border=0 src=""/civilwarbookreview/images/jackets/TexasArtifacts.jpg"">"	
4368	9781574412598	$34.95 hardcover	The Seventh Star of the Confederacy: Texas during the Civil War		Howell, Kenneth W. (ed.)			"<a href=""http://web3.unt.edu/untpress/catalog/detail.cfm?ID=309"" target=""resource window"">Click here for more information</a>"		Fall 2009	2009-11-01	Annotation			UNT Press					"<img hspace=6 align=LEFT width=161 height=241 alt=""Product Cover"" border=0 src=""/civilwarbookreview/images/jackets/SeventhStar.jpg"">"	
4802	9781574413120	$18.95 softcover	The Seventh Star of the Confederacy: Texas during the Civil War (now in paperback)		Howell, Kenneth W. (ed.)			"<a href=""http://web3.unt.edu/untpress/catalog/detail.cfm?ID=309"" target=""resource window"">Click here for more information</a>"		Spring 2011	2011-05-01	Annotation			UNT Press					"<img hspace=6 align=LEFT width=161 height=243 alt=""Product Cover"" border=0 src=""/civilwarbookreview/images/jackets/TheSeventhStarOfTheConfederacy.jpg"">"	
4543	9780980167245	$16.95 softcover	Battlefield Guide: Harpers Ferry, Antietam, Gettysburg: Poems		Martin, Rodger			"<a href=""http://webpages.charter.net/hobblebush/pages/battlefield.html"" target=""resource window"">Click here for more information</a>"		Spring 2010	2010-05-01	Annotation			Hobblebush Books					"<img hspace=6 align=LEFT width=161 height=246 alt=""Product Cover"" border=0 src=""/civilwarbookreview/images/jackets/BattlefieldGuide.jpg"">"	
5370	9781617951176	$14.99	Gideon's Call		Leavell, Peter			"<a href=""http://worthypublishing.com/books/Gideon%27s-Call/"">Click here for more information</a>"		Spring 2013	2013-05-01	Annotation			Worthy Publishing					"<img hspace=6 align=LEFT width=161 height=251 alt=""Product Cover"" border=0 src=""/civilwarbookreview/images/jackets/GideonsCall.jpg"">"	
5959	9781440831188	$48.00	A Finger in Lincoln's Brain: What Modern Science Reveals about Lincoln, His Assassination, and Its Aftermath		Abel, E. Lawrence			"<a href=""http://www.abc-clio.com/Praeger/product.aspx?pc=A4269C"">Click here for more information</a>"		Spring 2015	2015-05-01	Annotation			Praeger					"<img hspace=6 align=LEFT width=161 height=235 alt=""Product Cover"" border=0 src=""/civilwarbookreview/images/jackets/AFingerBrain.jpg"">"	
