ID	ISBN	Price	Title	Teaser	Auth_1	Auth_2	Auth_3	Review	Reviewer	Issue_date	Issue	Record_type	Sub_headline	Headline	Publisher	Pub_date	Categories	SubCategories	Metadata	Image	Field21
5629	9781611211528	$34.95	The Maps of the Bristoe Station and Mine Run Campaigns: An Atlas of the Battles and Movements in the Eastern Theater after Gettysburg, Including Rappahannock Station, Kelly's Ford, and Morton's Ford, July 1863 - February 1864		Gottfried, Bradley			"<a href=""http://www.savasbeatie.com/books/book_page.php?bookVAR=maps_of_bristoe_stations&bookType=about&authorID1=BMGottfried&authorID2=empty&authorID3=empty&authorID4=empty&authorID5=empty"">Click here for more information</a>"		Winter 2014	2014-02-01	Annotation			Savas Beatie					"<img hspace=6 align=LEFT width=161 height=226 alt=""Product Cover"" border=0 src=""/civilwarbookreview/images/jackets/TheMapsOfTheBristoe.jpg"">"	
6265	9781611212587	$39.95	The Maps of the Wilderness: An Atlas of the Wilderness Campaign, Including all Cavalry Operations, May 2-6, 1864		Gottfried, Bradley M.			"<a href=""http://www.savasbeatie.com/books/book_page.php?bookVAR=MapsWilderness&bookType=about&authorID1=BMGottfried&authorID2=empty&authorID3=empty&authorID4=empty&authorID5=empty"">Click here for more information</a>"		Summer 2016	2016-08-01	Annotation			Savas Beatie	2016				"<img hspace=6 align=LEFT width=161 height=230 alt=""Product Cover"" border=0 src=""/civilwarbookreview/images/jackets/MapsWildernessGottfried.jpg"">"	
5364	978-1-61121-086-6	$39.95	The Maps of Antietam: An Atlas of the Antietam (Sharpsburg) Campaign, Including the Battle of South Mountain, September 2 - 20, 1862		Gottfried, Bradley M.			"<a href=""http://www.savasbeatie.com/books/book_page.php?bookVAR=MOA&bookType=about&authorID1=BMGottfried&authorID2=empty&authorID3=empty&authorID4=empty&authorID5=empty"">Click here for more information</a>"		Spring 2013	2013-05-01	Annotation			Savas Beatie					"<img hspace=6 align=LEFT width=161 height=230 alt=""Product Cover"" border=0 src=""/civilwarbookreview/images/jackets/TheMapsOfAntietam.jpg"">"	
5014	9781611210781	$18.95 softcover	The New Gettysburg Campaign Handbook: June 9- July 14, 1863 Facts, Photos, and Artwork for Readers of all Ages		Petruzzi, J. David	Stanley, Steven		"<a href=""http://www.savasbeatie.com/books/book_page.php?bookVAR=NGHB&bookType=about&authorID1=JDPetruzzi&authorID2=SAStanley&authorID3=empty&authorID4=empty&authorID5=empty"" target=""resource window"">Click here for more information</a>"		Winter 2012	2012-02-01	Annotation			Savas Beatie					"<img hspace=6 align=LEFT width=161 height=243 alt=""Product Cover"" border=0 src=""/civilwarbookreview/images/jackets/TheNewGettysburg.jpg"">"	
6276	9781611212563	$14.95	Out Flew the Sabres: The Battle of Brandy Station, June 9, 1863		Wittenberg, Eric J.	Davis, Daniel T.		"<a href=""http://www.savasbeatie.com/books/book_page.php?bookVAR=OutFlewTheSabers&bookType=about&authorID1=EJWittenberg&authorID2=DTDavis&authorID3=empty&authorID4=empty&authorID5=empty"">Click here for more information</a>"		Summer 2016	2016-08-01	Annotation			Savas Beatie					"<img hspace=6 align=LEFT width=161 height=242 alt=""Product Cover"" border=0 src=""/civilwarbookreview/images/jackets/WittDavisOutFlewtheSabres.jpg"">"	
5365	978-1-61121-090-3	$34.95	The Petersburg Campaign Volume 1: The Eastern Front Battles June - August 1864		Bearss, Edwin C.			"<a href=""http://www.savasbeatie.com/books/book_page.php?bookVAR=PETERS_CAMP1&bookType=about&authorID1=ECBearss&authorID2=BASuderow&authorID3=empty&authorID4=empty&authorID5=empty"">Click here for more information</a>"		Spring 2013	2013-05-01	Annotation			Savas Beatie					"<img hspace=6 align=LEFT width=161 height=244 alt=""Product Cover"" border=0 src=""/civilwarbookreview/images/jackets/ThePetersburgCampaign.jpg"">"	
5715	9781611211047	$34.95	The Petersburg Campaign - Volume II: The Western Front Battles, September 1864-April 1865		Bearss, Edwin	Suderow, Bryce		"<a href=""http://www.savasbeatie.com/books/book_page.php?bookVAR=PETERS_CAMP2&bookType=about&authorID1=ECBearss&authorID2=BASuderow&authorID3=empty&authorID4=empty&authorID5=empty"">Click here for more information</a>"		Spring 2014	2014-05-01	Annotation			Savas Beatie					"<img hspace=6 align=LEFT width=161 height=244 alt=""Product Cover"" border=0 src=""/civilwarbookreview/images/jackets/ThePetersburgCampaign.jpg"">"	
6066	9781611212006	$37.95	Pickett's Charge at Gettysburg: A Guide to the Most Famous Attack in American History		Hessler, James A.	Motts, Wayne E.		"<a href=""http://www.savasbeatie.com/books/book_page.php?bookVAR=picketts_charge_at_gettysburg&bookType=about&authorID1=JAHessler&authorID2=WEMotts&authorID3=SAStanley&authorID4=empty&authorID5=empty"">Click here for more information</a>"		Fall 2015	2015-11-01	Annotation			Savas Beatie					"<img hspace=6 align=LEFT width=161 height=239 alt=""Product Cover"" border=0 src=""/civilwarbookreview/images/jackets/HesslerPickettChargingGuide.jpg"">"	
5440	978-1-611210-94-1	$16.95	Protecting the Flank at Gettysburg: The Battles for Brinkerhoff's Ridge and East Cavalry Field, July 2-3, 1863		Wittenberg, Eric J			"<a href=""http://www.savasbeatie.com/books/book_page.php?bookVAR=POF_GBURG&bookType=about&authorID1=EJWittenberg&authorID2=empty&authorID3=empty&authorID4=empty&authorID5=empty"">Click here for more information</a>"		Summer 2013	2013-08-01	Annotation			Savas Beatie					"<img hspace=6 align=LEFT width=161 height=242 alt=""Product Cover"" border=0 src=""/civilwarbookreview/images/jackets/ProtectingTheFlankAtGettysburg.jpg"">"	
5999	9781611212600	$26.95	Resisting Sherman: A Confederate Surgeon's Journal and the Civil War in the Carolinas, 1865		Robertson, Thomas Heard, Jr.			"<a href=""http://www.savasbeatie.com/books/book_page.php?bookVAR=ResistingSherman&bookType=about&authorID1=THRobertson&authorID2=empty&authorID3=empty&authorID4=empty&authorID5=empty"">Click here for more information</a>"		Summer 2015	2015-08-01	Annotation			Savas Beatie					"<img hspace=6 align=LEFT width=161 height=241 alt=""Product Cover"" border=0 src=""/civilwarbookreview/images/jackets/ResistingSherman.jpg"">"	
5621	9781611211207	$34.95	Robert E. Lee in War and Peace: The Photographic History of a Confederate and American Icon		Hopkins, Donald			"<a href=""http://www.savasbeatie.com/books/book_page.php?bookVAR=Robert_Lee&bookType=about&authorID1=DAHopkins&authorID2=empty&authorID3=empty&authorID4=empty&authorID5=empty"">Click here for more information</a>"		Winter 2014	2014-02-01	Annotation			Savas Beatie					"<img hspace=6 align=LEFT width=161 height=237 alt=""Product Cover"" border=0 src=""/civilwarbookreview/images/jackets/RobertELee.jpg"">"	
6141	9781611210743	$32.95	The Second Day at Gettysburg: The Attack and Defense of Cemetery Ridge, July 2, 1863		Schultz, David L.	Mingus, Scott L., Sr.		"<a href=""http://www.savasbeatie.com/books/book_page.php?bookVAR=SECOND_GBURG&bookType=about&authorID1=DLShultz&authorID2=DWWieck&authorID3=empty&authorID4=empty&authorID5=empty"">Click here for more information</a>"		Winter 2016	2016-02-01	Annotation			Savas Beatie					"<img hspace=6 align=LEFT width=161 height=237 alt=""Product Cover"" border=0 src=""/civilwarbookreview/images/jackets/SchultzMingusGettSecondDay.jpg"">"	
6270	9781611212884	$32.95	The Second Battle of Winchester: The Confederate Victory that Opened the Door to Gettysburg		Wittenberg, Eric J.	Mingus, Scott L.		"<a href=""http://www.savasbeatie.com/books/book_page.php?bookVAR=SecondBattleofWinchester&bookType=about&authorID1=EJWittenberg&authorID2=SLMingus&authorID3=empty&authorID4=empty&authorID5=empty"">Click here for more information</a>"		Summer 2016	2016-08-01	Annotation			Savas Beatie					"<img hspace=6 align=LEFT width=161 height=242 alt=""Product Cover"" border=0 src=""/civilwarbookreview/images/jackets/WittMingusSecondBattleofWinchester.jpg"">"	
5367	978-1-61121-146-7	$12.95	Simply Murder: The Battle of Fredericksburg, December 13, 1862		Mackowski, Chris	White, Kristopher D.		"<a href=""http://www.savasbeatie.com/books/book_page.php?bookVAR=SIMPLY_MURDER&bookType=about&authorID1=CMackowski&authorID2=KDWhite&authorID3=empty&authorID4=empty&authorID5=empty"">Click here for more information</a>"		Spring 2013	2013-05-01	Annotation			Savas Beatie					"<img hspace=6 align=LEFT width=161 height=245 alt=""Product Cover"" border=0 src=""/civilwarbookreview/images/jackets/SimplyMurder.jpg"">"	
6019	9781611211788	$32.95	Spies, Scouts, and Secrets in the Gettysburg Campaign: How the Critical Role of Intelligence Impacted the Outcome of Lee's Invasion of the North, June-July 1863		Ryan, Thomas J.			"<a href=""http://www.savasbeatie.com/books/book_page.php?bookVAR=SSS_GETTYSBURG&bookType=about&authorID1=TJRyan&authorID2=empty&authorID3=empty&authorID4=empty&authorID5=empty"">Click here for more information</a>"		Summer 2015	2015-08-01	Annotation			Savas Beatie					"<img hspace=6 align=LEFT width=161 height=219 alt=""Product Cover"" border=0 src=""/civilwarbookreview/images/jackets/SpiesScoutsSecretsGettysburg.jpg"">"	
6269	9781611213249	$22.95	"""Stand to It and Give Them Hell"": Gettysburg as the Soldiers Experienced It From Cemetery Ridge to Little Round Top, July 2, 1863 (new in paperback)"		Priest, John Michael			"<a href=""http://www.savasbeatie.com/books/book_page.php?bookVAR=STAND&bookType=about&authorID1=JMPriest"">Click here for more information</a>"		Summer 2016	2016-08-01	Annotation			Savas Beatie					"<img hspace=6 align=LEFT width=161 height=242 alt=""Product Cover"" border=0 src=""/civilwarbookreview/images/jackets/PriestStandtoItPaperback.jpg"">"	
5807	9781611211764	$32.95	"""Stand to It and Give Them Hell"": Gettysburg As The Soldiers Experienced It From Cemetery Ridge To Little Round Top, July 2, 1863"		Priest, John Michael			"<a href=""http://www.savasbeatie.com/books/book_page.php?bookVAR=STAND&bookType=about&authorID1=JMPriest&authorID2=empty&authorID3=empty&authorID4=empty&authorID5=empty"">Click here for more information</a>"		Fall 2014	2014-11-01	Annotation			Savas Beatie					"<img hspace=6 align=LEFT width=161 height=241 alt=""Product Cover"" border=0 src=""/civilwarbookreview/images/jackets/PriestGiveThemHell.jpg"">"	
5470	978-1-61121-150-4	$12.95	The Last Days of Stonewall Jackson: The Mortal Wounding of the Confederacy's Greatest Icon		Mackowski, Chris	White, Kristopher D.		"<a href=""http://www.savasbeatie.com/books/book_page.php?bookVAR=Stonewall_Jackson&bookType=about&authorID1=CMackowski&authorID2=KDWhite&authorID3=empty&authorID4=empty&authorID5=empty"">Click here for more information</a>"		Summer 2013	2013-08-01	Annotation			Savas Beatie					"<img hspace=6 align=LEFT width=161 height=245 alt=""Product Cover"" border=0 src=""/civilwarbookreview/images/jackets/LastDaysOfStonewallJackson.jpg"">"	
5550	9781611211382	$27.50	Calamity at Chancellorsville: The Wounding and Death of Confederate General Stonewall Jackson		Lively, Mathew			"<a href=""http://www.savasbeatie.com/books/book_page.php?bookVAR=STONEWALL&bookType=about&authorID1=MWLively&authorID2=empty&authorID3=empty&authorID4=empty&authorID5=empty"">Click here for more information</a>"		Fall 2013	2013-11-01	Annotation			Savas Beatie					"<img hspace=6 align=LEFT width=161 height=242 alt=""Product Cover"" border=0 src=""/civilwarbookreview/images/jackets/CalamityAtChancellorsville.jpg"">"	
6020	9781611212549	$12.95	Strike Them a Blow: Battle along the North Anna River, May 21-25, 1864		Mackowski, Chris			"<a href=""http://www.savasbeatie.com/books/book_page.php?bookVAR=StrikeThemABlow&bookType=about&authorID1=CMackowski&authorID2=empty&authorID3=empty&authorID4=empty&authorID5=empty"">Click here for more information</a>"		Summer 2015	2015-08-01	Annotation			Savas Beatie					"<img hspace=6 align=LEFT width=161 height=242 alt=""Product Cover"" border=0 src=""/civilwarbookreview/images/jackets/StrikeThemABlow.jpg"">"	
5815	9781611212198	$12.95	That Furious Struggle: Chancellorsville and the High Tide of the Confederacy, May 1-4, 1863		Mackowski, Chris	White, Kristopher D.		"<a href=""http://www.savasbeatie.com/books/book_page.php?bookVAR=TFurious_Struggle&bookType=about&authorID1=&authorID2=CMackowski&authorID3=KDWhite&authorID4=empty&authorID5=empty"">Click here for more information</a>"		Fall 2014	2014-11-01	Annotation			Savas Beatie					"<img hspace=6 align=LEFT width=161 height=242 alt=""Product Cover"" border=0 src=""/civilwarbookreview/images/jackets/ThatFuriousStruggle.jpg"">"	
6250	9781611212044	$32.95	"""The Bloody Fifth"": The 5th Texas Infantry Regiment, Hood's Texas Brigade, Army of Northern Virginia"		Schmutz, John F.			"<a href=""http://www.savasbeatie.com/books/book_page.php?bookVAR=the_bloody_fifth&bookType=about&authorID1=JFSchmutz&authorID2=empty&authorID3=empty&authorID4=empty&authorID5=empty"">Click here for more information</a>"		Summer 2016	2016-08-01	Annotation			Savas Beatie	2016				"<img hspace=6 align=LEFT width=161 height=241 alt=""Product Cover"" border=0 src=""/civilwarbookreview/images/jackets/bloodyschmutz copy.jpg"">"	
5872	9781611212082	$32.95	"""The Devil's to Pay"": John Buford at Gettysburg, A History and Walking Tour"		Wittenberg, Eric J.			"<a href=""http://www.savasbeatie.com/books/book_page.php?bookVAR=the_devils_to_pay&bookType=about&authorID1=EJWittenberg&authorID2=empty&authorID3=empty&authorID4=empty&authorID5=empty"">Click here for more information</a>"		Winter 2015	2015-02-01	Annotation			Savas Beatie					"<img hspace=6 align=LEFT width=161 height=242 alt=""Product Cover"" border=0 src=""/civilwarbookreview/images/jackets/TheDevilsToPayCover.jpg"">"	
6071	9781611212143	$27.95	The First Battle for Petersburg: The Attack and Defense of the Cockade City, June 9, 1864 (new edition)		Robertson, William Glenn			"<a href=""http://www.savasbeatie.com/books/book_page.php?bookVAR=the_first_battle_pb&bookType=about&authorID1=WGRobertson&authorID2=empty&authorID3=empty&authorID4=empty&authorID5=empty"">Click here for more information</a>"		Fall 2015	2015-11-01	Annotation			Savas Beatie					"<img hspace=6 align=LEFT width=161 height=242 alt=""Product Cover"" border=0 src=""/civilwarbookreview/images/jackets/RobertsonPetersburgFirstAttack.jpg"">"	
5894	9781611212129	$32.95	The Last Citadel: Petersburg June 1864- April 1865 (Revised Edition)		Trudeau, Noah Andre			"<a href=""http://www.savasbeatie.com/books/book_page.php?bookVAR=the_last_citadel&bookType=about&authorID1=NATrudeau&authorID2=empty&authorID3=empty&authorID4=empty&authorID5=empty"">Click here for more information</a>"		Winter 2015	2015-02-01	Annotation			Savas Beatie Publishing					"<img hspace=6 align=LEFT width=161 height=242 alt=""Product Cover"" border=0 src=""/civilwarbookreview/images/jackets/TheLastCitadelBurg.jpg"">"	
6080	9781611212662	$27.95	"""To Prepare for Sherman's Coming:"" The Battle of Wise's Forks, March 1865"		Sokolosky, Wade	Smith, Mark A.		"<a href=""http://www.savasbeatie.com/books/book_page.php?bookVAR=To_Prepare&bookType=about&authorID1=MASmith&authorID2=WSokolosky&authorID3=empty&authorID4=empty&authorID5=empty"">Click here for more information</a>"		Fall 2015	2015-11-01	Annotation			Savas Beatie					"<img hspace=6 align=LEFT width=161 height=242 alt=""Product Cover"" border=0 src=""/civilwarbookreview/images/jackets/SokoloskyPrepareWiseForks.jpg"">"	
6272	9781611213089	$29.95	Decision at Tom's Brook: George Custer, Thomas Rosser, and the Joy of the Fight		Miller, William J.			"<a href=""http://www.savasbeatie.com/books/book_page.php?bookVAR=TomsBrook&bookType=about&authorID1=WJMiller&authorID2=empty&authorID3=empty&authorID4=empty&authorID5=empty"">Click here for more information</a>"		Summer 2016	2016-08-01	Annotation			Savas Beatie					"<img hspace=6 align=LEFT width=161 height=242 alt=""Product Cover"" border=0 src=""/civilwarbookreview/images/jackets/MillerTomsBrook.jpg"">"	
5946	9781611212525	$12.95	To the Bitter End: Appomattox, Bennett Place, and the Surrenders of the Confederacy		Dunkerly, Robert M.			"<a href=""http://www.savasbeatie.com/books/book_page.php?bookVAR=ToTheBitterEnd&bookType=about&authorID1=RMDunkerly&authorID2=empty&authorID3=empty&authorID4=empty&authorID5=empty"">Click here for more information</a>"		Spring 2015	2015-05-01	Annotation			Savas Beatie					"<img hspace=6 align=LEFT width=161 height=242 alt=""Product Cover"" border=0 src=""/civilwarbookreview/images/jackets/ToTheBitterSurrenders.jpg"">"	
6145	9781611213003	$14.95	A Want of Vigilance: The Bristoe Station Campaign, October 9-19, 1863		Backus, Bill	Orrison, Robert		"<a href=""http://www.savasbeatie.com/books/book_page.php?bookVAR=Vigilance&bookType=about&authorID1=BBackus&authorID2=ROrrison&authorID3=empty&authorID4=empty&authorID5=empty"">Click here for more information</a>"		Winter 2016	2016-02-01	Annotation			Savas Beatie					"<img hspace=6 align=LEFT width=161 height=242 alt=""Product Cover"" border=0 src=""/civilwarbookreview/images/jackets/OrrisonWantingVigilance.jpg"">"	
4346	9781932714609	$34.95 hardcover	The Maps of First Bull Run: An Atlas of the First Bull Run (Manassas) Campaign, including the Battle of Ball’s Bluff, June-October 1861		Gottfried, Bradley M.			"<a href=""http://www.savasbeatie.com/books/BULLRUN_book.htm"" target=""resource window"">Click here for more information</a>"		Fall 2009	2009-11-01	Annotation			Savas Beatie					"<img hspace=6 align=LEFT width=161 height=230 alt=""Product Cover"" border=0 src=""/civilwarbookreview/images/jackets/MapsFirstBullRun.jpg"">"	
4340	9781932714630	$39.95 hardcover	The Complete Gettysburg Guide: Walking and Driving Tours of the Battlefield, Town, Cemeteries, Field Hospital Sites, and other Topics of Historical Interest		Petruzzi, J. David			"<a href=""http://www.savasbeatie.com/books/CGG_book.htm"" target=""resource window"">Click here for more information</a>"		Fall 2009	2009-11-01	Annotation			Savas Beatie					"<img hspace=6 align=LEFT width=161 height=232 alt=""Product Cover"" border=0 src=""/civilwarbookreview/images/jackets/GettysburgGuide.jpg"">"	
4412	9781932714722	$39.95 hardcover	The Maps of Chickamauga: An Atlas of the Chickamauga Campaign, Including the Tullahoma Operations, June 22 - September 23, 1863		Powell, David A.			"<a href=""http://www.savasbeatie.com/books/Chickamauga_book.htm"" target=""resource window"">Click here for more information</a>"		Winter 2010	2010-02-01	Annotation			Savas Beatie					"<img hspace=6 align=LEFT width=161 height=226 alt=""Product Cover"" border=0 src=""/civilwarbookreview/images/jackets/MapsOfChickamauga.jpg"">"	
4224	9781932714487	$32.95 hardcover	Those Damned Black Hats!: The Iron Brigade in the Gettysburg Campaign		Herdegen, Lance J.			"<a href=""http://www.savasbeatie.com/books/IRON_BRIGADE_book.htm"" target=""resource window"">Click here for more information</a>"		Spring 2009	2009-05-01	Annotation			Savas Beatie					"<img hspace=6 align=LEFT width=161 height=248 alt=""Product Cover"" border=0 src=""/civilwarbookreview/images/jackets/BlackHats.jpg"">"	
4611	9781932714838	$19.95 softcover	Those Damned Black Hats! : The Iron Brigade in the Gettysburg Campaign		Herdegen, Lance J.			"<a href=""http://www.savasbeatie.com/books/IRON_BRIGADE_book.htm"" target=""resource window"">Click here for more information</a>"		Summer 2010	2010-08-01	Annotation			Savas Beatie					"<img hspace=6 align=LEFT width=161 height=240 alt=""Product Cover"" border=0 src=""/civilwarbookreview/images/jackets/ThoseDamnedBlackHats.jpg"">"	
4360	9781932714616	$32.95 hardcover	The Unpopular Mr. Lincoln: The Story of America’s Most Reviled President		Tagg, Larry			"<a href=""http://www.savasbeatie.com/books/LINCOLN_book.htm"" target=""resource window"">Click here for more information</a>"		Fall 2009	2009-11-01	Annotation			Savas Beatie					"<img hspace=6 align=LEFT width=161 height=250 alt=""Product Cover"" border=0 src=""/civilwarbookreview/images/jackets/UnpopularLincoln.jpg"">"	
4329	9781932714623	$14.95 softcover	The New Civil War Handbook: Facts and Photos for Readers of All Ages		Hughes, Mark			"<a href=""http://www.savasbeatie.com/books/NCW_book.htm"" target=""resource window"">Click here for more information</a>"		Fall 2009	2009-11-01	Annotation			Savas Beatie LLC					"<img hspace=6 align=LEFT width=161 height=249 alt=""Product Cover"" border=0 src=""/civilwarbookreview/images/jackets/CivilWarHandbook.jpg"">"	
4206	9781932714432	$34.95 hardcover	One Continuous Fight: The Retreat from Gettysburg and the Pursuit of Lee’s Army of Northern Virginia, July 4-14, 1865		Wittenberg, Eric J.,	Petruzzi, J. David		"<a href=""http://www.savasbeatie.com/books/OCF_book.htm"" target=""resource window"">Click here for more information</a>"		Spring 2009	2009-05-01	Annotation			Savas Beatie					"<img hspace=6 align=LEFT width=161 height=240 alt=""Product Cover"" border=0 src=""/civilwarbookreview/images/jackets/OneContinuousFight.jpg"">"	
4785	9781611210767	$22.95 softcover	One Continuous Fight: The Retreat from Gettysburg and the Pursuit of Lee’s Army of Northern Virginia, July 4-14, 1863 (new in paper)		Wittenberg, Eric J. (ed.)	Petruzzi, J. David and Nugent, Michael F. (eds.)		"<a href=""http://www.savasbeatie.com/books/OCF_book.htm"" target=""resource window"">Click here for more information</a>"		Spring 2011	2011-05-01	Annotation			Savas Beatie					"<img hspace=6 align=LEFT width=161 height=244 alt=""Product Cover"" border=0 src=""/civilwarbookreview/images/jackets/OneContinuousFight.jpg"">"	
5001	9781611210989	$22.95 softcover	Plenty of Blame to go Around: Jeb Stuart’s Controversial Ride to Gettysburg (new in paper)		Wittenberg, Eric J.	Petruzzi, J. David		"<a href=""http://www.savasbeatie.com/books/POBTGA_book.htm"" target=""resource window"">Click here for more information</a>"		Winter 2012	2012-02-01	Annotation			Savas Beatie					"<img hspace=6 align=LEFT width=161 height=242 alt=""Product Cover"" border=0 src=""/civilwarbookreview/images/jackets/PlentyOfBlame.jpg"">"	
4079	9781932714098	$32.95 hardcover	Robert E. Rodes		Collins, Darrell L.			"<a href=""http://www.savasbeatie.com/books/Rodes_book.htm""target=""resource window"">Click here for more information</a>"		Fall 2008	2008-11-01	Annotation			Savas Beatie					"<img hspace=6 align=LEFT width=161 height=243 alt=""Product Cover"" border=0 src=""/civilwarbookreview/images/jackets/RobertERodes.jpg"">"	
4356	9781932714647	$24.95 hardcover	Sickles at Gettysburg: The Controversial Civil War General Who Committed Murder, Abandoned Little Round Top, and Declared Himself the Hero of Gettysburg		Hessler, James A.			"<a href=""http://www.savasbeatie.com/books/SICKLES_book.htm"" target=""resource window"">Click here for more information</a>"		Fall 2009	2009-11-01	Annotation			Savas Beatie					"<img hspace=6 align=LEFT width=161 height=246 alt=""Product Cover"" border=0 src=""/civilwarbookreview/images/jackets/Sickles.jpg"">"	
4530	9781932714845	$22.95 softcover	Sickles at Gettysburg: The Controversial Civil War General Who Committed Murder, Abandoned Little Round Top, and Declared Himself the Hero of Gettysburg (Now in Paper)		Hessler, James A.			"<a href=""http://www.savasbeatie.com/books/SICKLES_book.htm"" target=""resource window"">Click here for more information</a>"		Spring 2010	2010-05-01	Annotation			Savas Beatie					"<img hspace=6 align=LEFT width=161 height=244 alt=""Product Cover"" border=0 src=""/civilwarbookreview/images/jackets/Sickles.jpg"">"	
5950	9781611212495	$22.95	The Battle of Monroe's Crossroads and the Civil War's Final Campaign		Bradley, Mark L.			"<a href=""http://www.savasbeatie.com/books/TBOMC_book.htm"">Click here for more information</a>"		Spring 2015	2015-05-01	Annotation			Savas Beatie					"<img hspace=6 align=LEFT width=161 height=241 alt=""Product Cover"" border=0 src=""/civilwarbookreview/images/jackets/BattleOfMonroeRoads.jpg"">"	
5555	9781611211481	$12.95	A Season of Slaughter: The Battle of Spotsylvania Court House, May 8-21, 1864		Mackowski, Chris	White, Kristopher D.		"<a href=""http://www.savasbeatie.com/search_fp.php?quickfind=a+season+of+slaughter&x=0&y=0"">Click here for more information</a>"		Fall 2013	2013-11-01	Annotation			Savas Beatie					"<img hspace=6 align=LEFT width=161 height=248 alt=""Product Cover"" border=0 src=""/civilwarbookreview/images/jackets/ASeasonOfSlaughter.jpg"">"	
5398	978-1-61121-102-3	$26.95	Divided Loyalties: Kentucky's Struggle for Armed Neutrality in the Civil War		Finck, James W.	Davis, William C.		"<a href=""http://www.savasbeatie.com/search_fp.php?quickfind=Divided+Loyalties&x=0&y=0"">Click here for more information</a>"		Spring 2013	2013-05-01	Annotation			Savas Beatie Publishing					"<img hspace=6 align=LEFT width=161 height=249 alt=""Product Cover"" border=0 src=""/civilwarbookreview/images/jackets/DividedLoyaltiesKentuckys.jpg"">"	
5549	9781611211405	$32.95	John Bell Hood: The Rise, Fall, and Resurrection of a Confederate General		Hood, Stephen			"<a href=""http://www.savasbeatie.com/search_fp.php?quickfind=john+bell+hood&x=0&y=0"">Click here for more information</a>"		Fall 2013	2013-11-01	Annotation			Savas Beatie					"<img hspace=6 align=LEFT width=161 height=245 alt=""Product Cover"" border=0 src=""/civilwarbookreview/images/jackets/JohnBellHood.jpg"">"	
5543	9781611210804	$32.95	The Gettysburg Campaign in Numbers and Losses: Synopses, Orders of Battle, Strengths, Casualties, and Maps, June 9-July 14, 1863		Petruzzi, J. David	Stanley, Steven		"<a href=""http://www.savasbeatie.com/search_fp.php?quickfind=the+gettysburg+campaign+in+numbers+and+losses&x=0&y=0"">Click here for more information</a>"		Fall 2013	2013-11-01	Annotation			Savas Beatie					"<img hspace=6 align=LEFT width=161 height=228 alt=""Product Cover"" border=0 src=""/civilwarbookreview/images/jackets/TheGettysburgCampaign.jpg"">"	
