ID	ISBN	Price	Title	Teaser	Auth_1	Auth_2	Auth_3	Review	Reviewer	Issue_date	Issue	Record_type	Sub_headline	Headline	Publisher	Pub_date	Categories	SubCategories	Metadata	Image	Field21
6279	9781476664491	$29.95	Captaining the Corps d'Afrique: The Civil War Diaries and Letters of John Newton Chamberlain		Chamberlain, John Newton	Bisbee, John		"<a href=""http://www.mcfarlandbooks.com/book-2.php?id=978-1-4766-6449-1"">Click here for more information</a>"		Summer 2016	2016-08-01	Annotation			McFarland					"<img hspace=6 align=LEFT width=161 height=242 alt=""Product Cover"" border=0 src=""/civilwarbookreview/images/jackets/BisbeeCaptainingtheCorpsdAfrique.jpg"">"	
6280	9781476665139	$35.00	John Surratt: Rebel, Lincoln Conspirator, Fugitive		Hatch, Frederick			"<a href=""http://www.mcfarlandbooks.com/book-2.php?id=978-1-4766-6513-9"">Click here for more information</a>"		Summer 2016	2016-08-01	Annotation			McFarland					"<img hspace=6 align=LEFT width=161 height=230 alt=""Product Cover"" border=0 src=""/civilwarbookreview/images/jackets/HatchJohnSurratt.jpg"">"	
6183	9781476665221	$35.00	The Last Civil War Veterans: The Lives of the Final Survivors, State by State		Grzyb, Frank L.			"<a href=""http://www.mcfarlandbooks.com/book-2.php?id=978-1-4766-6522-1"">Click here for more information</a>"		Spring 2016	2016-05-01	Annotation			McFarland					"<img hspace=6 align=LEFT width=161 height=242 alt=""Product Cover"" border=0 src=""/civilwarbookreview/images/jackets/GrzybLastCivilWarVeterans.jpg"">"	
3653	786427329	$29.95	Wilson's Cavalry Corps: Union Campaigns in the Western Theatre, October 1864 through Spring 1865		Keenan, Jerry			"<a href=""http://www.mcfarlandpub.com/book-2.php?id=1037"" target=""resource window"">Click here for more information</a>"		Winter 2007	2007-02-01	Annotation			McFarland Press					"<img hspace=6 align=LEFT width=161 height=246 alt=""Product Cover"" border=0 src=""/civilwarbookreview/images/jackets/WilsonsCavalry.jpg"">"	
3630	786424672	$45.00	Black Resistance to the Ku Klux Klan in the Wake of Civil War		Kinshasa, Kwando Mbiassi			"<a href=""http://www.mcfarlandpub.com/book-2.php?id=1088"" target=""resource window"">Click here for more information</a>"		Winter 2007	2007-02-01	Annotation			McFarland Press					"<img hspace=6 align=LEFT width=161 height=233 alt=""Product Cover"" border=0 src=""/civilwarbookreview/images/jackets/BlackResistance.jpg"">"	
3641	786425083	$39.95	"""My Will is Absolute Law"": A Biography of Union General Robert H. Milroy"		Noyalas, Jonathan A.			"<a href=""http://www.mcfarlandpub.com/book-2.php?id=1556"" target=""resource window"">Click here for more information</a>"		w	2007-02-01	Annotation			McFarland Press					"<img hspace=6 align=LEFT width=161 height=245 alt=""Product Cover"" border=0 src=""/civilwarbookreview/images/jackets/MyWill.jpg"">"	
3644	786425415	$35.00	The Battle of Olustee, 1864: The Final Union Attempt to Seize Florida		Broadwater, Robert P.			"<a href=""http://www.mcfarlandpub.com/book-2.php?id=184"" target=""resource window"">Click here for more information</a>"		Winter 2007	2007-02-01	Annotation			McFarland Press					"<img hspace=6 align=LEFT width=161 height=241 alt=""Product Cover"" border=0 src=""/civilwarbookreview/images/jackets/TheBattleOfOlustee.jpg"">"	
3742	9780786424603	$32.00 softcover	Confederate General Lloyd Tilghman: A Biography		Raab, James W.			"<a href=""http://www.mcfarlandpub.com/book-2.php?id=978-0-7864-2460-3"" target=""resource window"">Click here for more information</a>"		Summer 2007	2007-08-01	Annotation			McFarland & Company, Inc., Publishers					"<img hspace=6 align=LEFT width=161 height=246 alt=""Product Cover"" border=0 src=""/civilwarbookreview/images/jackets/ConfederateGeneralLloyd.jpg"">"	
3705	786425210	$39.95	The Union Sixth Army Corps in the Chancellorsville Campaign: A Study of the Engagements of Second Fredericksburg, Salem Church and Banks's Ford, May 3-4, 1863		Parsons, Philip W.			"<a href=""http://www.mcfarlandpub.com/book-2.php?id=978-0-7864-2521-1"" target=""resource window"">Click here for more information</a>"		Spring 2007	2007-05-01	Annotation			McFarland Press					"<img hspace=6 align=LEFT width=161 height=230 alt=""Product Cover"" border=0 src=""/civilwarbookreview/images/jackets/TheUnionSixth.jpg"">"	
3682	786425849	$55.00	Brandy Station: Virginia, June 9, 1863: The Largest Cavalry Battle of the Civil War		McKinney, Joseph W.			"<a href=""http://www.mcfarlandpub.com/book-2.php?id=978-0-7864-2584-6"" target=""resource window"">Click here for more information</a>"		Spring 2007	2007-05-01	Annotation			McFarland Publishing					"<img hspace=6 align=LEFT width=161 height=225 alt=""Product Cover"" border=0 src=""/civilwarbookreview/images/jackets/BrandyStation.jpg"">"	
3685	786426497	$35.00	Collett Leventhorpe, the English Confederate: The Life of a Civil War General, 1815-1889		Cole, J. Timothy			"<a href=""http://www.mcfarlandpub.com/book-2.php?id=978-0-7864-2649-2"" target=""resource window"">Click here for more information</a>"		Spring 2007	2007-05-01	Annotation			McFarland Publishing					"<img hspace=6 align=LEFT width=161 height=243 alt=""Product Cover"" border=0 src=""/civilwarbookreview/images/jackets/CollettLaventhorpe.jpg"">"	
3797	9780786427338	$45.00 hardcover	Guerrilla Warfare in Civil War Missouri, Volume II, 1863		Nichols, Bruce			"<a href=""http://www.mcfarlandpub.com/book-2.php?id=978-0-7864-2733-8"" target=""resource window"">Click here for more information</a>"		Fall 2007	2007-11-01	Annotation			McFarland & Company, Inc., Publishers					"<img hspace=6 align=LEFT width=161 height=229 alt=""Product Cover"" border=0 src=""/civilwarbookreview/images/jackets/GuerrillaWarfare.jpg"">"	
3819	9780786427666	$35.00 softcover	The Man Who Made the Monitor: A Biography of John Ericsson, Naval Engineer		Thulesius, Olav			"<a href=""http://www.mcfarlandpub.com/book-2.php?id=978-0-7864-2766-6"" target=""resource window"">Click here for more information</a>"		Fall 2007	2007-11-01	Annotation			McFarland & Company, Inc., Publishers					"<img hspace=6 align=LEFT width=161 height=242 alt=""Product Cover"" border=0 src=""/civilwarbookreview/images/jackets/TheManWho.jpg"">"	
3766	9780786428243	$45.00 hardcover	Torn Families: Death and Kinship at the Battle of Gettysburg		Dreese, Michael A.			"<a href=""http://www.mcfarlandpub.com/book-2.php?id=978-0-7864-2824-3"" target=""resource window"">Click here for more information</a>"		Summer 2007	2007-08-01	Annotation			McFarland & Company, Inc., Publishers					"<img hspace=6 align=LEFT width=161 height=234 alt=""Product Cover"" border=0 src=""/civilwarbookreview/images/jackets/TornFamilies.jpg"">"	
3743	9780786428687	$35.00 softcover	Confederate Spies at Large: The Lives of Lincoln Assassination Conspirator Tom Harbin and Charlie Russell		Stewart, John			"<a href=""http://www.mcfarlandpub.com/book-2.php?id=978-0-7864-2868-7"" target=""resource window"">Click here for more information</a>"		Summer 2007	2007-08-01	Annotation			McFarland & Company, Inc., Publishers					"<img hspace=6 align=LEFT width=161 height=240 alt=""Product Cover"" border=0 src=""/civilwarbookreview/images/jackets/ConfederateSpies.jpg"">"	
3879	9780786428700	$35.00 softcover	Tales from the North and the South: Twenty-Four Remarkable People and Events of the Civil War		Casstevens, Frances H.			"<a href=""http://www.mcfarlandpub.com/book-2.php?id=978-0-7864-2870-0"" target=""resource window"">Click here for more information</a>"		Winter 2008	2008-02-01	Annotation			McFarland Publishing					"<img hspace=6 align=LEFT width=161 height=244 alt=""Product Cover"" border=0 src=""/civilwarbookreview/images/jackets/TalesFromTheNorth.jpg"">"	
3816	9780786429561	$29.95 hardcover	The 4th North Carolina Cavalry in the Civil War: A History and Roster		Raiford, Neil Hunter			"<a href=""http://www.mcfarlandpub.com/book-2.php?id=978-0-7864-2956-1"" target=""resource window"">Click here for more information</a>"		Fall 2007	2007-11-01	Annotation			McFarland & Company, Inc., Publishers					"<img hspace=6 align=LEFT width=161 height=228 alt=""Product Cover"" border=0 src=""/civilwarbookreview/images/jackets/The4thNorthCarolina.jpg"">"	
3874	9780786429752	$55.00 hardcover	Le Roy Fitch: The Civil War Career of a Union River Gunboat Commander		Smith, Myron J., Jr.			"<a href=""http://www.mcfarlandpub.com/book-2.php?id=978-0-7864-2975-2"" target=""resource window"">Click here for more information</a>"		Winter 2008	2008-02-01	Annotation			McFarland Publishing					"<img hspace=6 align=LEFT width=161 height=235 alt=""Product Cover"" border=0 src=""/civilwarbookreview/images/jackets/LeRoyFitch.jpg"">"	
3881	9780786429783	$55.00 hardcover	The Civil War in Tennessee, 1862-1863		Lepa, Jack H.			"<a href=""http://www.mcfarlandpub.com/book-2.php?id=978-0-7864-2978-3"" target=""resource window"">Click here for more information</a>"		Winter 2008	2008-02-01	Annotation			McFarland Publishing					"<img hspace=6 align=LEFT width=161 height=235 alt=""Product Cover"" border=0 src=""/civilwarbookreview/images/jackets/TheCivilWarInTennessee.jpg"">"	
3880	9780786429974	$55.00 hardcover	The 115th New York in the Civil War: A Regimental History		Silo, Mark			"<a href=""http://www.mcfarlandpub.com/book-2.php?id=978-0-7864-2997-4"" target=""resource window"">Click here for more information</a>"		Winter 2008	2008-02-01	Annotation			McFarland Publishing					"<img hspace=6 align=LEFT width=161 height=240 alt=""Product Cover"" border=0 src=""/civilwarbookreview/images/jackets/The115th.jpg"">"	
3870	9780786429981	$55.00 hardcover	Irish Americans in the Confederate Army		O'Brien, Sean Michael			"<a href=""http://www.mcfarlandpub.com/book-2.php?id=978-0-7864-2998-1"" target=""resource window"">Click here for more information</a>"		Winter 2008	2008-02-01	Annotation			McFarland Publishing					"<img hspace=6 align=LEFT width=161 height=236 alt=""Product Cover"" border=0 src=""/civilwarbookreview/images/jackets/IrishAmericans.jpg"">"	
3954	9780786430123	$55.00 hardcover	The Fourth Louisiana Battalion in the Civil War: A History and Roster		Scriber, Terry G.	Arnold-Scriber, Theresa		"<a href=""http://www.mcfarlandpub.com/book-2.php?id=978-0-7864-3012-3"" target=""resource window"">Click here for more information</a>"		Spring 2008	2008-05-01	Annotation			McFarland Publishing					"<img hspace=6 align=LEFT width=161 height=243 alt=""Product Cover"" border=0 src=""/civilwarbookreview/images/jackets/TheFourthLouisiana.jpg"">"	
3822	9780786430260	$39.95 hardcover	The Sixth United States Infantry Regiment, 1855 to Reconstruction		Swanson, Clifford L.			"<a href=""http://www.mcfarlandpub.com/book-2.php?id=978-0-7864-3026-0"" target=""resource window"">Click here for more information</a>"		Fall 2007	2007-11-01	Annotation			McFarland & Company, Inc., Publishers					"<img hspace=6 align=LEFT width=161 height=231 alt=""Product Cover"" border=0 src=""/civilwarbookreview/images/jackets/TheSixthUnitedStates.jpg"">"	
3387	9780786430567	$55.00 hardcover	The London Confederates: The Officials, Clergy, Businessmen and Journalists Who Backed the American South During the Civil War		Bennett, John D.			"<a href=""http://www.mcfarlandpub.com/book-2.php?id=978-0-7864-3056-7"" target=""resource window"">Click here for more information</a>"		Spring 2008	2008-05-01	Annotation			McFarland Publishing					"<img hspace=6 align=LEFT width=161 height=246 alt=""Product Cover"" border=0 src=""/civilwarbookreview/images/jackets/TheLondon.jpg"">"	
4161	9780786431489	$55.00 hardcover	Voices of the Confederate Navy: Articles, Letters, Reports and Reminiscences		Campbell, Thomas R., ed.			"<a href=""http://www.mcfarlandpub.com/book-2.php?id=978-0-7864-3148-9"" target=""resource window"">Click here for more information</a>"		Winter 2009	2009-02-01	Annotation			McFarland					"<img hspace=6 align=LEFT width=161 height=235 alt=""Product Cover"" border=0 src=""/civilwarbookreview/images/jackets/VoicesOfTheConfederateNavy.jpg"">"	
3950	9780786431588	$55.00 hardcover	The 28th North Carolina Infantry: A Civil War History and Roster		Casstevens, Frances H.			"<a href=""http://www.mcfarlandpub.com/book-2.php?id=978-0-7864-3158-8"" target=""resource window"">Click here for more information</a>"		Spring 2008	2008-05-01	Annotation			McFarland Publishing					"<img hspace=6 align=LEFT width=161 height=246 alt=""Product Cover"" border=0 src=""/civilwarbookreview/images/jackets/The20thNorthCarolina.jpg"">"	
3952	9780786431755	$55.00 hardcover	The Civil War on Pensacola Bay, 1861-1862		Driscoll, John K.			"<a href=""http://www.mcfarlandpub.com/book-2.php?id=978-0-7864-3175-5"" target=""resource window"">Click here for more information</a>"		Spring 2008	2008-05-01	Annotation			McFarland Publishing					"<img hspace=6 align=LEFT width=161 height=238 alt=""Product Cover"" border=0 src=""/civilwarbookreview/images/jackets/TheCivilWarOnPensacola.jpg"">"	
4133	9780786431861	$35.00 softcover	Civil War Museum Treasures: Outstanding Artifacts and the Stories Behind Them		Alford, Kenneth D.			"<a href=""http://www.mcfarlandpub.com/book-2.php?id=978-0-7864-3186-1"" target=""resource window"">Click here for more information</a>"		Winter 2009	2009-02-01	Annotation			McFarland					"<img hspace=6 align=LEFT width=161 height=232 alt=""Product Cover"" border=0 src=""/civilwarbookreview/images/jackets/CivilWarMuseumTreasures.jpg"">"	
4081	9780786432103	$45.00 hardcover	The 11th Wisconsin in the Civil War: A Regimental History		Wehner, Christopher C.			"<a href=""http://www.mcfarlandpub.com/book-2.php?id=978-0-7864-3210-3"" target=""resource window"">Click here for more information</a>"		Fall 2008	2008-11-01	Annotation			McFarland					"<img hspace=6 align=LEFT width=161 height=234 alt=""Product Cover"" border=0 src=""/civilwarbookreview/images/jackets/The11thWisconsinInTheCivilWar.jpg"">"	
4142	9780786432257	$49.95 hardcover	George Stoneman: A Biography of the Union General		Fordney, Ben Fuller			"<a href=""http://www.mcfarlandpub.com/book-2.php?id=978-0-7864-3225-7"" target=""resource window"">Click here for more information</a>"		Winter 2009	2009-02-01	Annotation			McFarland					"<img hspace=6 align=LEFT width=161 height=244 alt=""Product Cover"" border=0 src=""/civilwarbookreview/images/jackets/GeorgeStoneman.jpg"">"	
3945	9780786432263	$75.00 hardcover	Ship Island, Mississippi: Rosters and History of the Civil War Prison		Arnold-Scriber, Theresa	Scriber, Terry G.		"<a href=""http://www.mcfarlandpub.com/book-2.php?id=978-0-7864-3236-3"" target=""resource window"">Click here for more information</a>"		Spring 2008	2008-05-01	Annotation			McFarland Publishing					"<img hspace=6 align=LEFT width=161 height=234 alt=""Product Cover"" border=0 src=""/civilwarbookreview/images/jackets/ShipIsland.jpg"">"	
4128	9780786432578	$39.95 softcover	Bear Flag and Bay State in the Civil War: The Californians of the Second Massachusetts Cavalry		Parson, Thomas E.			"<a href=""http://www.mcfarlandpub.com/book-2.php?id=978-0-7864-3257-8"" target=""resource window"">Click here for more information</a>"		Winter 2009	2009-02-01	Annotation			McFarland					"<img hspace=6 align=LEFT width=161 height=235 alt=""Product Cover"" border=0 src=""/civilwarbookreview/images/jackets/BearFlagAndBayState.jpg"">"	
4088	978078643279	$55.00 hardcover	The Ninth Vermont Infantry: A History and Roster		Zeller, Paul G.			"<a href=""http://www.mcfarlandpub.com/book-2.php?id=978-0-7864-3279-0"" target=""resource window"">Click here for more information</a>"		Fall 2008	2008-11-01	Annotation			McFarland					"<img hspace=6 align=LEFT width=161 height=230 alt=""Product Cover"" border=0 src=""/civilwarbookreview/images/jackets/TheNinthVermontInfantry.jpg"">"	
4137	9780786432806	$35.00 softcover	Confederate Guerrilla Sue Mundy: A Biography of Kentucky Soldier Jerome Clarke		Watson, Thomas Shelby	Brantley, Perry A.		"<a href=""http://www.mcfarlandpub.com/book-2.php?id=978-0-7864-3280-6"" target=""resource window"">Click here for more information</a>"		Winter 2009	2009-02-01	Annotation			McFarland					"<img hspace=6 align=LEFT width=161 height=254 alt=""Product Cover"" border=0 src=""/civilwarbookreview/images/jackets/ConfederateGuerrillaSueMundy.jpg"">"	
4140	9780786432899	$35.00 softcover	Drummer Boy Willie McGee, Civil War Hero and Fraud		Fox, Thomas			"<a href=""http://www.mcfarlandpub.com/book-2.php?id=978-0-7864-3289-9"" target=""resource window"">Click here for more information</a>"		Winter 2009	2009-02-01	Annotation			McFarland					"<img hspace=6 align=LEFT width=161 height=247 alt=""Product Cover"" border=0 src=""/civilwarbookreview/images/jackets/DrummerBoyWillieMcGee.jpg"">"	
4019	9780786433049	$39.95 softcover	The Causes of the Civil War:  The Political, Cultural, Economic and Territorial Disputes Between North and South		Calore, Paul			"<a href=""http://www.mcfarlandpub.com/book-2.php?id=978-0-7864-3304-9"" target=""resource window"">Click here for more information</a>"		Summer 2008	2008-08-01	Annotation			McFarland & Company, Inc.					"<img hspace=6 align=LEFT width=161 height=247 alt=""Product Cover"" border=0 src=""/civilwarbookreview/images/jackets/CausesofCivilWarPoliticalCulturalEconomicTerritorialDisputes.jpg"">"	
4144	9780786433100	$55.00 hardcover	Identification Discs of Union Soldiers in the Civil War: A Complete Classification Guide and Illustrated History		Maier, Larry B.	Stahl, Joseph W.		"<a href=""http://www.mcfarlandpub.com/book-2.php?id=978-0-7864-3310-0"" target=""resource window"">Click here for more information</a>"		Winter 2009	2009-02-01	Annotation			McFarland					"<img hspace=6 align=LEFT width=161 height=240 alt=""Product Cover"" border=0 src=""/civilwarbookreview/images/jackets/IdentificationDiscs.jpg"">"	
4057	9780786433230	$55.00 hardcover	August Valentine Kautz, USA		Kautz, Lawrence G.			"<a href=""http://www.mcfarlandpub.com/book-2.php?id=978-0-7864-3323-0"" target=""resource window"">Click here for more information</a>"		Fall 2008	2008-11-01	Annotation			McFarland					"<img hspace=6 align=LEFT width=161 height=242 alt=""Product Cover"" border=0 src=""/civilwarbookreview/images/jackets/AugustValentineKautzUSA.jpg"">"	
4260	9780786433612	$45.00 softcover	Did Lincoln and the Republican Party Create the Civil War?: An Argument		Broadwater, Robert P.			"<a href=""http://www.mcfarlandpub.com/book-2.php?id=978-0-7864-3361-2"" target=""resource window"">Click here for more information</a>"		Summer 2009	2009-08-01	Annotation			McFarland & Company, Inc.					"<img hspace=6 align=LEFT width=161 height=245 alt=""Product Cover"" border=0 src=""/civilwarbookreview/images/jackets/LincolnAndRepublicanParty.jpg"">"	
4063	9780786433742	$45.00 softcover	George F. Root, Civil War Songwriter		Carder, P.H.			"<a href=""http://www.mcfarlandpub.com/book-2.php?id=978-0-7864-3374-2""target=""resource window"">Click here for more information</a>"		Fall 2008	2008-11-01	Annotation			McFarland					"<img hspace=6 align=LEFT width=161 height=248 alt=""Product Cover"" border=0 src=""/civilwarbookreview/images/jackets/CivilWarSongwriter.jpg"">"	
4527	9780786433834	$45.00 softcover	The First Vermont Cavalry in the Civil War: A History		Collea, Joseph D. Jr.			"<a href=""http://www.mcfarlandpub.com/book-2.php?id=978-0-7864-3383-4"" target=""resource window"">Click here for more information</a>"		Spring 2010	2010-05-01	Annotation			McFarland					"<img hspace=6 align=LEFT width=161 height=236 alt=""Product Cover"" border=0 src=""/civilwarbookreview/images/jackets/VermontCavalry.jpg"">"	
4800	9780786434381	$38.00 softcover	The Fifty-Eighth North Carolina Troops:  Tar Heels in the Army of Tennessee		Hardy, Michael C.			"<a href=""http://www.mcfarlandpub.com/book-2.php?id=978-0-7864-3438-1"" target=""resource window"">Click here for more information</a>"		Spring 2011	2011-05-01	Annotation			McFarland					"<img hspace=6 align=LEFT width=161 height=238 alt=""Product Cover"" border=0 src=""/civilwarbookreview/images/jackets/TheFiftyEighthNorthCarolinaTroops.jpg"">"	
4073	9780786434497	$39.95 softcover	Norton Parker Chipman		Hogge, Jeffery A.			"<a href=""http://www.mcfarlandpub.com/book-2.php?id=978-0-7864-3449-7""target=""resource window"">Click here for more information</a>"		Fall 2008	2008-11-01	Annotation			McFarland					"<img hspace=6 align=LEFT width=161 height=247 alt=""Product Cover"" border=0 src=""/civilwarbookreview/images/jackets/NortonParkerChipman.jpg"">"	
4125	9780786435364	$55.00 hardcover	Abraham Lincoln on Screen: Fictional and Documentary Portrayals on Film and Television		Reinhart, Mark S.			"<a href=""http://www.mcfarlandpub.com/book-2.php?id=978-0-7864-3536-4"" target=""resource window"">Click here for more information</a>"		Winter 2009	2009-02-01	Annotation			McFarland					"<img hspace=6 align=LEFT width=161 height=229 alt=""Product Cover"" border=0 src=""/civilwarbookreview/images/jackets/LincolnOnScreen.jpg"">"	
4091	9780786435784	$75.00 hardcover	The Timberclads in the Civil War		Smith, Myron J. Jr.			"<a href=""http://www.mcfarlandpub.com/book-2.php?id=978-0-7864-3578-4"" target=""resource window"">Click here for more information</a>"		Fall 2008	2008-11-01	Annotation			McFarland						
4158	9780786435784	$75.00 hardcover	The Timberclads in the Civil War: The Lexington, Conestoga, and Tyler on the Western Waters		Smith, Myron J., Jr.			"<a href=""http://www.mcfarlandpub.com/book-2.php?id=978-0-7864-3578-4"" target=""resource window"">Click here for more information</a>"		Winter 2009	2009-02-01	Annotation			McFarland					"<img hspace=6 align=LEFT width=161 height=236 alt=""Product Cover"" border=0 src=""/civilwarbookreview/images/jackets/TheTimbercladsInTheCivilWar.jpg"">"	
4139	9780786436538	$39.95 softcover	Crisis of Command in the Army of the Potomac		Simson, Jay W.			"<a href=""http://www.mcfarlandpub.com/book-2.php?id=978-0-7864-3653-8"" target=""resource window"">Click here for more information</a>"		Winter 2009	2009-02-01	Annotation			McFarland					"<img hspace=6 align=LEFT width=161 height=236 alt=""Product Cover"" border=0 src=""/civilwarbookreview/images/jackets/CrisisOfCommand.jpg"">"	
4170	9780786436538	$39.95 softcover	Crisis of Command in the Army of the Potomac		Simson, Jay W.			"<a href=""http://www.mcfarlandpub.com/book-2.php?id=978-0-7864-3653-8"" target=""resource window"">Click here for more information</a>"		Winter 2009	2009-02-01	Annotation			McFarland					"<img hspace=6 align=LEFT width=161 height=236 alt=""Product Cover"" border=0 src=""/civilwarbookreview/images/jackets/CrisisOfCommand.jpg"">"	
4267	9780786437283	$39.95 softcover	Henry Toole Clark: Civil War Governor of North Carolina		Poteat, R. Matthew			"<a href=""http://www.mcfarlandpub.com/book-2.php?id=978-0-7864-3728-3"" target=""resource window"">Click here for more information</a>"		Summer 2009	2009-08-01	Annotation			McFarland & Company, Inc.					"<img hspace=6 align=LEFT width=161 height=234 alt=""Product Cover"" border=0 src=""/civilwarbookreview/images/jackets/HenryTooleClark.jpg"">"	
4257	9780786437955	$59.95 hardcover	Cobb’s Legion Cavalry: A History and Roster of the Ninth Georgia Volunteers in the Civil War		Mesic, Harriet Bey			"<a href=""http://www.mcfarlandpub.com/book-2.php?id=978-0-7864-3795-5"" target=""resource window"">Click here for more information</a>"		Summer 2009	2009-08-01	Annotation			McFarland & Company, Inc.					"<img hspace=6 align=LEFT width=161 height=228 alt=""Product Cover"" border=0 src=""/civilwarbookreview/images/jackets/CobbsLegion.jpg"">"	
4197	9780786438563	$39.95 softcover	General George H. Thomas: A Biography of the Union’s “Rock of Chickamauga”		Broadwater, Robert P.			"<a href=""http://www.mcfarlandpub.com/book-2.php?id=978-0-7864-3856-3"" target=""resource window"">Click here for more information</a>"		Spring 2009	2009-05-01	Annotation			McFarland & Company, Inc.					"<img hspace=6 align=LEFT width=161 height=235 alt=""Product Cover"" border=0 src=""/civilwarbookreview/images/jackets/GeneralThomas.jpg"">"	
4294	9780786438570	$55.00 hardcover	The Civil War Roster of Davie County, North Carolina: Biographies of 1,147 Men Before, During and After the Conflict		Hasty, Mary Alice M.	Winfree, Hazel M.		"<a href=""http://www.mcfarlandpub.com/book-2.php?id=978-0-7864-3857-0"" target=""resource window"">Click here for more information</a>"		Summer 2009	2009-08-01	Annotation			McFarland & Company, Inc.					"<img hspace=6 align=LEFT width=161 height=232 alt=""Product Cover"" border=0 src=""/civilwarbookreview/images/jackets/CivilWarRoster.jpg"">"	
4264	9780786439300	$39.95 softcover	Fitz-John Porter, Scapegoat of Second Manassas: The Rise, Fall and Rise of the General Accused of Disobedience		Jermann, Donald R.			"<a href=""http://www.mcfarlandpub.com/book-2.php?id=978-0-7864-3930-0"" target=""resource window"">Click here for more information</a>"		Summer 2009	2009-08-01	Annotation			McFarland & Company, Inc.					"<img hspace=6 align=LEFT width=161 height=250 alt=""Product Cover"" border=0 src=""/civilwarbookreview/images/jackets/FitzJohnPorter.jpg"">"	
4291	9780786439829	$75.00 hardcover	The Battle of the Crater: A Complete History		Schmutz, John F.			"<a href=""http://www.mcfarlandpub.com/book-2.php?id=978-0-7864-3982-9"" target=""resource window"">Click here for more information</a>"		Summer 2009	2009-08-01	Annotation			McFarland & Company, Inc.					"<img hspace=6 align=LEFT width=161 height=238 alt=""Product Cover"" border=0 src=""/civilwarbookreview/images/jackets/BattleCrater.jpg"">"	
4290	9780786439911	$55.00 hardcover	The 25th North Carolina Troops in the Civil War: History and Roster of a Mountain-Bred Regiment		Jones, Carroll C.			"<a href=""http://www.mcfarlandpub.com/book-2.php?id=978-0-7864-3991-1"" target=""resource window"">Click here for more information</a>"		Summer 2009	2009-08-01	Annotation			McFarland & Company, Inc.					"<img hspace=6 align=LEFT width=161 height=234 alt=""Product Cover"" border=0 src=""/civilwarbookreview/images/jackets/NorthCarolinaTroops.jpg"">"	
